{
  "nome_do_dataset": "Biografia Histórica dos Atletas",
  "fonte": "Base dos Dados / Olympedia",
  "descricao": "Dados biográficos de atletas desde 1896, contendo sexo, altura e peso.",
  "campos_principais": ["athlete_id", "name", "sex", "country"],
  "data_de_coleta": "2026-03-29",
  "observacoes": "A coluna sex precisa ser cruzada com a tabela de resultados para sabermos a edição que o atleta participou."
}