{
  "nome_do_dataset": "Medalhas Históricas das Olimpíadas",
  "fonte": "Olympedia / Kaggle",
  "descricao": "Base de dados com a contagem histórica de medalhas por país e edição das Olimpíadas, desde 1896.",
  "campos_principais": [
    "year", "edition", "edition_id", "country", "country_noc", "gold", "silver", "bronze", "total"
  ],
  "data_de_coleta": "2026-03-29",
  "observacoes": "Necessita de integração com os dados de Paris 2024. As colunas estão em letras minúsculas."
}