{
  "nome_do_dataset": "Sumário do Quadro de Medalhas Geral",
  "fonte": "Data Lake - Camada Bronze",
  "descricao": "Agrupamento final das medalhas por país de todos os tempos, ordenado pelo padrão olímpico (Ouro, Prata, Bronze). Contém o Top 50.",
  "campos_principais": [
    "country", "gold", "silver", "bronze", "total"
  ],
  "data_de_coleta": "2026-03-29",
  "observacoes": "Este dataset serve de base para o relatório visual gerado em medalhas_plot.png."
}