{
  "nome_do_dataset": "Atletas de Paris 2024",
  "fonte": "Kaggle",
  "descricao": "Informações biográficas dos atletas de Paris 2024, incluindo o gênero.",
  "campos_principais": ["name", "gender", "country", "disciplines"],
  "data_de_coleta": "2026-03-29",
  "observacoes": "Crucial para a análise de participação por gênero."
}