{
  "nome_do_dataset": "Resultados Históricos de Eventos",
  "fonte": "Base dos Dados / Olympedia",
  "descricao": "Tabela de ligação entre atletas, esportes, eventos e medalhas ganhas (1896-2022).",
  "campos_principais": ["edition", "sport", "event", "athlete_id", "medal"],
  "data_de_coleta": "2026-03-29",
  "observacoes": "Chave principal para JOIN com a biografia dos atletas."
}