{
  "nome_do_dataset": "Quadro de Medalhas Paris 2024",
  "fonte": "Comitê Olímpico Internacional (COI)",
  "descricao": "Quadro final e consolidado de medalhas dos Jogos Olímpicos de Paris 2024.",
  "campos_principais": [
    "country_code", "country", "country_long", "Gold Medal", "Silver Medal", "Bronze Medal", "Total"
  ],
  "data_de_coleta": "2026-03-29",
  "observacoes": "A nomenclatura das colunas difere da base histórica (ex: 'Gold Medal' vs 'gold'). Será necessário padronizar os nomes durante a transformação para a camada bronze."
}